{
  "schema_version": "control-plane/approval/v1",
  "approval_id": "demo_shop/approvals/1",
  "project_ref": "demo_shop",
  "decision": "granted",
  "configuration_ref": {
    "configuration_id": "demo_shop/configurations/1",
    "digest": "sha256:c58eafbcbd07b8624c912f6d1c5175ee3a2cf79d2f6a77f0795a4d53d0602257"
  },
  "proposal_ref": {
    "proposal_id": "demo_shop/proposals/1",
    "digest": "sha256:4d23090cfb237053bbab14d5e17f7bbe651ef17ccf9cb1b2eb72b006de22f50d"
  },
  "requirements_ref": {
    "requirements_id": "demo_shop/requirements/1",
    "digest": "sha256:aeeb7017bd8c6a68057ac2cf5aeb3110e1e3bbc1fa6a864157756dc2086b49a9"
  },
  "acknowledged_findings": [
    "fnd-c70c9039bd17"
  ],
  "approver": {
    "authority_ref": null,
    "kind": "owner",
    "reference": "Kvasha62"
  },
  "decided_at": "2026-10-04T04:00:00Z",
  "reason": "Accept the resolved configuration; the open requirement is acknowledged.",
  "revokes": null,
  "predecessor": null,
  "digest": "sha256:adeb2ac3a86e6cf50532fbb241c635eab04a149daebddd4f7d3dca62afc51cac"
}
